#!/usr/bin/env tclsh
set testdir [file dirname $argv0]
source $testdir/tester.tcl

do_execsql_test_on_specific_db {:memory:} basic-insert {
    create table temp (t1 integer, primary key (t1));
    insert into temp values (1);
    select * from temp;
} {1}

do_execsql_test_on_specific_db {:memory:} must-be-int-insert {
    create table temp (t1 integer, primary key (t1));
    insert into temp values (1),(2.0),('3'),('4.0');
    select * from temp;
} {1
2
3
4}

do_execsql_test_on_specific_db {:memory:} strict-basic-creation {
    CREATE TABLE test1(id INTEGER, name TEXT, price REAL) STRICT;
    INSERT INTO test1 VALUES(1, 'item1', 10.5);
    SELECT * FROM test1;
} {1|item1|10.5}

do_execsql_test_in_memory_any_error  strict-require-datatype {
    CREATE TABLE test2(id INTEGER, name) STRICT;
}

do_execsql_test_in_memory_any_error strict-valid-datatypes {
    CREATE TABLE test2(id INTEGER, value DATETIME) STRICT;
}

do_execsql_test_in_memory_any_error strict-type-enforcement {
    CREATE TABLE test3(id INTEGER, name TEXT, price REAL) STRICT;
    INSERT INTO test3 VALUES(1, 'item1', 'not-a-number');
}

do_execsql_test_on_specific_db {:memory:} strict-type-coercion {
    CREATE TABLE test4(id INTEGER, name TEXT, price REAL) STRICT;
    INSERT INTO test4 VALUES(1, 'item1', '10.5');
    SELECT typeof(price), price FROM test4;
} {real|10.5}

do_execsql_test_on_specific_db {:memory:} strict-any-flexibility {
    CREATE TABLE test5(id INTEGER, data ANY) STRICT;
    INSERT INTO test5 VALUES(1, 100);
    INSERT INTO test5 VALUES(2, 'text');
    INSERT INTO test5 VALUES(3, 3.14);
    SELECT id, typeof(data) FROM test5 ORDER BY id;
} {1|integer
2|text
3|real}

do_execsql_test_on_specific_db {:memory:} strict-any-preservation {
    CREATE TABLE test6(id INTEGER, code ANY) STRICT;
    INSERT INTO test6 VALUES(1, '000123');
    SELECT typeof(code), code FROM test6;
} {text|000123}

do_execsql_test_in_memory_any_error strict-int-vs-integer-pk {
    CREATE TABLE test8(id INT PRIMARY KEY, name TEXT) STRICT
    INSERT INTO test8 VALUES(NULL, 'test');
}

do_execsql_test_on_specific_db {:memory:} strict-integer-pk-behavior {
    CREATE TABLE test9(id INTEGER PRIMARY KEY, name TEXT) STRICT;
    INSERT INTO test9 VALUES(NULL, 'test');
    SELECT id, name FROM test9;
} {1|test}


do_execsql_test_on_specific_db {:memory:} strict-mixed-inserts {
    CREATE TABLE test11(
        id INTEGER PRIMARY KEY,
        name TEXT,
        price REAL,
        quantity INT,
        tags ANY
    ) STRICT;

    INSERT INTO test11 VALUES(1, 'item1', 10.5, 5, 'tag1');
    INSERT INTO test11 VALUES(2, 'item2', 20.75, 10, 42);

    SELECT id, name, price, quantity, typeof(tags) FROM test11 ORDER BY id;
} {1|item1|10.5|5|text
2|item2|20.75|10|integer}

do_execsql_test_on_specific_db {:memory:} strict-update-basic {
    CREATE TABLE test1(id INTEGER, name TEXT, price REAL) STRICT;
    INSERT INTO test1 VALUES(1, 'item1', 10.5);
    UPDATE test1 SET price = 15.75 WHERE id = 1;
    SELECT * FROM test1;
} {1|item1|15.75}

do_execsql_test_in_memory_any_error  strict-update-type-enforcement {
    CREATE TABLE test2(id INTEGER, name TEXT, price REAL) STRICT;
    INSERT INTO test2 VALUES(1, 'item1', 10.5);
    UPDATE test2 SET price = 'not-a-number' WHERE id = 1;
}

do_execsql_test_on_specific_db {:memory:} strict-update-type-coercion {
    CREATE TABLE test3(id INTEGER, name TEXT, price REAL) STRICT;
    INSERT INTO test3 VALUES(1, 'item1', 10.5);
    UPDATE test3 SET price = '15.75' WHERE id = 1;
    SELECT id, typeof(price), price FROM test3;
} {1|real|15.75}

do_execsql_test_on_specific_db {:memory:} strict-update-any-flexibility {
    CREATE TABLE test4(id INTEGER, data ANY) STRICT;
    INSERT INTO test4 VALUES(1, 100);
    UPDATE test4 SET data = 'text' WHERE id = 1;
    INSERT INTO test4 VALUES(2, 'original');
    UPDATE test4 SET data = 3.14 WHERE id = 2;
    SELECT id, typeof(data), data FROM test4 ORDER BY id;
} {1|text|text
2|real|3.14}

do_execsql_test_on_specific_db {:memory:} strict-update-any-preservation {
    CREATE TABLE test5(id INTEGER, code ANY) STRICT;
    INSERT INTO test5 VALUES(1, 'text');
    UPDATE test5 SET code = '000123' WHERE id = 1;
    SELECT typeof(code), code FROM test5;
} {text|000123}

do_execsql_test_in_memory_any_error strict-update-not-null-constraint {
    CREATE TABLE test7(id INTEGER, name TEXT NOT NULL) STRICT;
    INSERT INTO test7 VALUES(1, 'name');
    UPDATE test7 SET name = NULL WHERE id = 1;
}

# Uncomment following test case when unique constraint is added
#do_execsql_test_any_error strict-update-pk-constraint {
#    CREATE TABLE test8(id INTEGER PRIMARY KEY, name TEXT) STRICT;
#    INSERT INTO test8 VALUES(1, 'name1');
#    INSERT INTO test8 VALUES(2, 'name2');
#    UPDATE test8 SET id = 2 WHERE id = 1;
#}

do_execsql_test_on_specific_db {:memory:} strict-update-multiple-columns {
    CREATE TABLE test9(id INTEGER, name TEXT, price REAL, quantity INT) STRICT;
    INSERT INTO test9 VALUES(1, 'item1', 10.5, 5);
    UPDATE test9 SET name = 'updated', price = 20.75, quantity = 10 WHERE id = 1;
    SELECT * FROM test9;
} {1|updated|20.75|10}

do_execsql_test_on_specific_db {:memory:} strict-update-where-clause {
    CREATE TABLE test10(id INTEGER, category TEXT, price REAL) STRICT;
    INSERT INTO test10 VALUES(1, 'A', 10);
    INSERT INTO test10 VALUES(2, 'A', 20);
    INSERT INTO test10 VALUES(3, 'B', 30);
    UPDATE test10 SET price = price * 2 WHERE category = 'A';
    SELECT id, price FROM test10 ORDER BY id;
} {1|20.0
2|40.0
3|30.0}

do_execsql_test_on_specific_db {:memory:} strict-update-expression {
    CREATE TABLE test11(id INTEGER, name TEXT, price REAL, discount REAL) STRICT;
    INSERT INTO test11 VALUES(1, 'item1', 100, 0.1);
    UPDATE test11 SET price = price - (price * discount);
    SELECT id, price FROM test11;
} {1|90.0}

do_execsql_test_on_specific_db {:memory:} named-insert-1 {
    CREATE TABLE test (id INTEGER PRIMARY KEY AUTOINCREMENT, col_a TEXT, col_b TEXT, col_c TEXT, col_d TEXT);
    INSERT INTO test (col_b, col_d, col_a, col_c) VALUES ('1', '2', '3', '4');
    SELECT * FROM test;
} {1|3|1|4|2}

do_execsql_test_on_specific_db {:memory:} named-insert-2 {
    CREATE TABLE test (id INTEGER PRIMARY KEY AUTOINCREMENT, col_a TEXT DEFAULT 'Empty', col_b TEXT, col_c TEXT, col_d TEXT);
    INSERT INTO test (col_b, col_d, col_c) VALUES ('1', '2', '4');
    SELECT * FROM test;
} {1|Empty|1|4|2}

do_execsql_test_on_specific_db {:memory:} multi-rows {
    CREATE TABLE test (id INTEGER PRIMARY KEY AUTOINCREMENT, col);
    INSERT INTO test (col) VALUES (1),(1);
    SELECT * FROM test;
} {1|1
2|1}

do_execsql_test_on_specific_db {:memory:} unique_insert_no_pkey {
    CREATE TABLE t2 (x INTEGER, y INTEGER UNIQUE);
    INSERT INTO t2 (y) VALUES (1);
    INSERT INTO t2 (y) VALUES (6);
    SELECT * FROM t2;
} {|1
|6}

do_execsql_test_on_specific_db {:memory:} unique_insert_with_pkey {
    CREATE TABLE t2 (x INTEGER PRIMARY KEY, y INTEGER UNIQUE);
    INSERT INTO t2 (y) VALUES (1);
    INSERT INTO t2 (y) VALUES (6);
    SELECT * FROM t2;
} {1|1
2|6}
